input_index,input_context,input_file_key,input_first_author,worker_id_w1,work_time_in_seconds_w1,label_w1,worker_id_w2,work_time_in_seconds_w2,label_w2,worker_id_w3,work_time_in_seconds_w3,label_w3,batch,majority_vote,majority_agreement,lemos_label,temp_label_3/3
4724,"We fine-tune a stateof-the-art vision transformer model pretrained with masked autoencoding (He et al., 2021) for 100 epochs on rotated MNIST (Weiler and Cesa, 2019) (details in Appendix C.",RS_040_MLRC_2022_40,"Cited Paper: (He et al., 2021)",A2QD9PJUKW7PKK,49,Positive,A2HM35CWB7IIFM,4,Positive,A18LFH7XW61JO9,12,Positive,batch_4,Positive,3,Positive,OK
4840,"He et al., 2022) and VideoMAE (Tong et al., 2022) to conduct further comparison on video and image datasets, which follows the self-supervised pre-training setting2 in S. Chen et al. (2022) except that the batch size is set to 256 instead of 1, 024.",RS_102_MLRC_2020_09,First Author: Sohn,A18LFH7XW61JO9,12,Positive,A2HM35CWB7IIFM,4,Positive,A5V3ZMQI0PU3F,85,Neutral,batch_15,Positive,2,Positive,OK
5027,"Different from existing works that focus on MVM for pure vision problems [4, 22, 86], we study MVM as a VidL pre-training task.",RS_040_MLRC_2022_40,First Author: He,A2QD9PJUKW7PKK,110,Positive,A2HM35CWB7IIFM,5,Positive,A3NAHN61XJ3ZAT,8,Neutral,batch_4,Positive,2,Positive,OK
5630,"For the MAE, we only modified its input size of the ViT model in its encoder and decoder (from 224 to 512), and other model details are the same as those in [10].",RS_040_MLRC_2022_40,First Author: He,A2HM35CWB7IIFM,5,Positive,A18LFH7XW61JO9,21,Positive,A5V3ZMQI0PU3F,23,Positive,batch_5,Positive,3,Positive,OK
5814,"rying out the masked image modeling task (He et al., 2022; Xie et al., 2022).",RS_040_MLRC_2022_40,First Author: He,A18LFH7XW61JO9,14,Neutral,A5V3ZMQI0PU3F,8,Neutral,A2HM35CWB7IIFM,5,Neutral,batch_5,Neutral,3,Neutral,OK
5913,"Unlike MAE (He et al., 2021) that shuffles or unshuffles the token list, we gather the vector of target patches in the correct order.",RS_040_MLRC_2022_40,"Cited Paper: (He et al., 2021)",A18LFH7XW61JO9,11,Positive,A2QD9PJUKW7PKK,881,Neutral,A3NAHN61XJ3ZAT,7,Neutral,batch_5,Neutral,2,Neutral,OK
6159,"Compared with MAE-Base [26], ConvMAE-Base improves the ImageNet-1K finetuning accuracy to 85.",RS_040_MLRC_2022_40,First Author: He,A18LFH7XW61JO9,15,Positive,A2HM35CWB7IIFM,5,Positive,A3NAHN61XJ3ZAT,9,Neutral,batch_5,Positive,2,Positive,OK
6326,The ViT models are pre-trained using MAE [23] on IN-1K.,RS_040_MLRC_2022_40,First Author: He,A2QD9PJUKW7PKK,44,Positive,A3NAHN61XJ3ZAT,6,Neutral,A2HM35CWB7IIFM,5,Positive,batch_5,Positive,2,Positive,OK
6924,"The original MAE [16] masks random patches of the input image, but the same strategy is not suitable for our DeepfakeMAE for the following reasons.",RS_040_MLRC_2022_40,First Author: He,A3NAHN61XJ3ZAT,10,Negative,A18LFH7XW61JO9,12,Positive,A2HM35CWB7IIFM,7,Negative,batch_5,Negative,2,Negative,OK
7078,"This random masking strategy is also consistent with pioneering self-supervised learning approaches that conjugate masked image modeling with the ViT models in a patch-wise manner (Bao et al., 2021; He et al., 2022; Xie et al., 2022).",RS_040_MLRC_2022_40,First Author: He,A2QD9PJUKW7PKK,85,Neutral,A3NAHN61XJ3ZAT,7,Neutral,A2HM35CWB7IIFM,4,Positive,batch_5,Neutral,2,Neutral,OK
7082,"We compare ViT-B trained by different methods: supervised model (ERM), multimodal learning - CLIP (Radford et al., 2021), and self-supervised learning - DINO (Caron et al., 2021) and MAE (He et al., 2022).",RS_040_MLRC_2022_40,"Cited Paper: (He et al., 2022)",A3NAHN61XJ3ZAT,14,Positive,A2HM35CWB7IIFM,6,Positive,A2QD9PJUKW7PKK,1252,Positive,batch_5,Positive,3,Positive,OK
7098,"However, the encoder for MAE is a vision transformer [56], which is not suitable for processing high-resolution SAR images due to its huge memory usage.",RS_040_MLRC_2022_40,First Author: He,A2HM35CWB7IIFM,6,Negative,A18LFH7XW61JO9,13,Negative,A2QD9PJUKW7PKK,23123,Negative,batch_5,Negative,3,Negative,OK
7185,"Inspired by MAE (He et al., 2022), we observe a different information density between sentences and documents  for an event, most parts of the document are irrelevant, leading to a low information density.",RS_040_MLRC_2022_40,"Cited Paper: (He et al., 2022)",A3NAHN61XJ3ZAT,18,Negative,AKSJ3C5O3V9RB,4886,Negative,A27PVIL93ZMY46,182,Positive,batch_5,Negative,2,Negative,OK
7215,"It is further MAE fine-tuned (He et al., 2021), using the same in-domain data as for the Mask R-CNN object detector.",RS_040_MLRC_2022_40,"Cited Paper: (He et al., 2021)",A2QD9PJUKW7PKK,83,Positive,A1G94QON7A9K0N,38,Positive,A2HM35CWB7IIFM,4,Positive,batch_6,Positive,3,Positive,OK
7373,"Unlike MAE [9], the reconstruction target for large-scale point clouds is set to whether the voxel contains the point clouds, and the Encoder is built with the 3D Spatially Sparse Convolutions to handle the large-scale unmasked voxels.",RS_040_MLRC_2022_40,First Author: He,A2QD9PJUKW7PKK,142,Neutral,A2HM35CWB7IIFM,4,Positive,A3NAHN61XJ3ZAT,23,Neutral,batch_6,Neutral,2,Neutral,OK
7648,"Similarly as [30], we employ random masking of 75% of the patches.",RS_040_MLRC_2022_40,First Author: He,A37WXDYYT7RCZ0,3,Neutral,AJ0RL2YCXZC25,15,Positive,A2HM35CWB7IIFM,4,Positive,batch_6,Positive,2,Positive,OK
7689,"Inspired by the form of the training sample, we propose the center-masked pre-training task, which is similar to MAE [18] but our method is easier to implement.",RS_040_MLRC_2022_40,First Author: He,A2QD9PJUKW7PKK,140,Positive,A2HM35CWB7IIFM,4,Positive,AJ0RL2YCXZC25,24,Positive,batch_6,Positive,3,Positive,OK